frame,definition,example
f:Artificiality,"An <em>Entity</em> is evaluated for whether or not it belongs to a particular <em>Type</em> in a context where its category membership is doubtful. The criterion or criteria that are relevant to evaluating <em>Type</em> membership depend on the individual lexical units and/or on the context. Typically, either the material composition of the <em>Entity</em>, its method of creation, or the identity (and proper authority) of its creators are critical for proper category membership. Note that <em>Entity</em> also covers behaviors.",<p class='list-group-item'>It can be hard to get your money back after discovering you've bought a <span id='phrase_example'>bogus</span> autograph  for hundreds or thousands of dollars! </p><p class='list-group-item'>A <span id='phrase_example'>bogus</span>  policeman  pulling over motorists was arrested after stopping a car carrying four real officers.</p><p class='list-group-item'>You people are pretty thick if you think you have evidence to prove that  the moon landing  was <span id='phrase_example'>fake</span>.</p>
f:Difficulty,"An <em>Experiencer</em> has an easy or difficult time carrying out an <em>Activity</em>. The ease or difficulty associated with the <em>Activity</em> seems to often be associated with a prominent participant. However, we consider this impression to be due to the syntax and pragmatics of the relevant sentence constructions and employ no special FE for such participants. The <em>Degree</em> of ease or difficulty is often specified as well as a set of <em>Circumstances</em>. A <em>Parameter</em> may be mentioned that indicates in which respect the <em>Activity</em> is judged to be easy or difficult.",<p class='list-group-item'>(1)  John  is <span id='phrase_example'>easy</span>  to please .</p><p class='list-group-item'>(2) It is <span id='phrase_example'>easy</span>  to get Alex annoyed .</p><p class='list-group-item'>(3)  Smithers  is  very  <span id='phrase_example'>tough</span>  for me   to please .</p><p class='list-group-item'>(4)  VWs  are <span id='phrase_example'>easy</span>  to repair .</p><p class='list-group-item'>(5)  The dating of western sculpture  is <span id='phrase_example'>difficult</span>.</p><p class='list-group-item'>(6)  In that kind of wind   the course  is  physically   very  <span id='phrase_example'>tricky</span>.</p><p class='list-group-item'>(7)  The last question on the exam  was <span id='phrase_example'>hard</span>. </p><p class='list-group-item'>(8) The last one was a <span id='phrase_example'>hard</span>  question   to answer .</p>
f:Body_description_part,This frame is concerned with words that describe a person based on a salient part of their body.,<p class='list-group-item'>He was a <span id='phrase_example'>blonde</span>  guy .</p><p class='list-group-item'> He  was a <span id='phrase_example'>peg-leg</span>.</p>
f:Measure_mass,"This frame is concerned with nouns that denote <em>Unit</em>s of measurement for masses. The Frame Elements are <em>Unit</em>, <em>Count</em>,  and <em>Stuff</em>.",<p class='list-group-item'>Jelena bought  three  <span id='phrase_example'> kilos </span>  of apples .</p><p class='list-group-item'>Add  a  <span id='phrase_example'> pound </span>  of sugar .</p>
f:Being_strong,An <em>Entity</em> can bear a great outer force so as to resist destruction and damage.,"<p class='list-group-item'>The great and <span id='phrase_example'>impregnable</span>  fortress  still stands today.</p><p class='list-group-item'> His heart  is  by no means  <span id='phrase_example'>strong</span>, so he should ease into his exercise regime.</p>"
f:Body_description_holistic,"This frame covers descriptions of an entire human body, viewed as a gestalt (as opposed to descriptions based on salient body parts).  The Frame Elements are <em>Individual</em> and <em>Figure</em>.",<p class='list-group-item'>Chuck  is <span id='phrase_example'>muscular</span>.</p><p class='list-group-item'> Chuck  has a <span id='phrase_example'>muscular</span> body.</p>
f:Ratification,A <em>Ratifier</em> responds to a <em>Proposal</em> constructed by another party to make it binding over the <em>Ratifier</em>'s jurisdiction or constituency.,"<p class='list-group-item'>The <span id='phrase_example'>ratification</span>  of the Kyoto protocol  has been a long, hard slog.</p><p class='list-group-item'> The US  is considering <span id='phrase_example'>ratifying</span>  the cybercrime treaty . </p><p class='list-group-item'> The Malaysian government  will <span id='phrase_example'>ratify</span>  the UN's anti-smoking programme  by the end of the year.</p>"
f:Activity_ready_state,"The <em>Protagonist</em> is in an initial state, before beginning to be involved in the <em>Activity</em>, but all pre-conditions for performance of the <em>Activity</em> have been satisfied.  In many cases, the <em>Protagonist</em> is an intentional agent, but there are other uses in which the agent is deprofiled, and the <em>Protagonist</em> is an entity which is essential to the <em>Activity</em>.  
Alternatively, the <em>Activity</em> may be indicated by a <em>Salient entity</em> which stands in for the <em>Activity</em>.  This <em>Salient entity</em> may also be an intentional agent, but need not be.","<p class='list-group-item'>She  's not <span id='phrase_example'>ready</span> !   .</p><p class='list-group-item'> He  's <span id='phrase_example'>ready</span>  to talk  , I think .</p><p class='list-group-item'>Is  the UK government  <span id='phrase_example'>ready</span>  to do a u-turn on passport-ID cards  ?</p><p class='list-group-item'>Check and see if  Sal  is <span id='phrase_example'>ready</span>  for the bathtub  .</p><p class='list-group-item'> The world  is finally <span id='phrase_example'>prepared</span>  for him  !</p>"
f:Indigenous_origin,"An <em>Entity</em> began its existence in the context of a location of <em>Origin</em>, which is a discourse-salient place, or culture.","<p class='list-group-item'>Obviously there are  species   that  are <span id='phrase_example'>native</span>  to China  or used in Chinese Medicine that aren't used in Western or Cherokee Medicine and vice versa. </p><p class='list-group-item'>The <span id='phrase_example'>indigenous</span>  people , women and the elderly are the most affected.   </p><p class='list-group-item'>The Athenians believed that  they  were '<span id='phrase_example'>autochthonous</span>'  in Attica .</p>"
f:Completeness,"A <em>Whole</em>, an entity with a substructure, is assessed for whether or not it has all the necessary parts that are defined for it or for an entity of its kind. The entity can be a concrete physical thing, an abstract thing, or a process with goals or sub-goals.","<p class='list-group-item'>What happens after  the PPB investigation  is <span id='phrase_example'>complete</span>? </p><p class='list-group-item'>Enter the number of days since the last <span id='phrase_example'>complete</span>  backup  was made.</p><p class='list-group-item'>This distinguishes them from organisms in the phylum Platyhelminthes, who have only an <span id='phrase_example'>incomplete</span>  digestive tract .</p><p class='list-group-item'>We now have an  almost  <span id='phrase_example'>complete</span>  understanding  of the model</p><p class='list-group-item'>Auditors should also assess the accuracy and <span id='phrase_example'>completeness</span>  of the systems and data .</p>"
f:Ruling_legally,An <em>Authority</em> with the power to make decisions hands down a <em>Finding</em> over a question presented in a formal or informal <em>Case</em>.,"<p class='list-group-item'>The judge  <span id='phrase_example'>ruled</span>  yesterday   that the revisions were not adequate .   </p><p class='list-group-item'> A high court in London  <span id='phrase_example'>ruled</span>  on the case   that a vulture fund can extract more than $20 million from Zambia for a debt .</p><p class='list-group-item'> In the California case ,  a judge  <span id='phrase_example'>ruled</span>  Oct. 12   that Tendler must pay the bloggers' legal fees .</p>"
f:Trajector-Landmark,"Basic Image Schema: contains a (more) profiled element, the <em>Trajector</em>, and an un- or less profiled element, the <em>Landmark</em>.  In combination with a schematically-defined <em>Profiled region</em> (with a pre-defined relationship to the <em>Landmark</em>), the <em>Landmark</em> serves as the basis for understanding the status or location of the <em>Trajector</em>.  
This schema essentially establishes a point-of-view or focus.  above.prep and below.prep both make use of the verticality schema, but are differentiated by whether the <em>Landmark</em> is associated with the upper region and the <em>Profiled region</em> with the lower or vice-versa.","<p class='list-group-item'>The cat  <span id='phrase_example'>in</span>  the shed  purred violently .</p><p class='list-group-item'> The shed  <span id='phrase_example'>around</span>  the cat  shook .</p><p class='list-group-item'>We 'll have to  leave  <span id='phrase_example'>before</span>  noon  .</p><p class='list-group-item'>In the 1990s , though ,  the rate at which DNA could be read  revved <span id='phrase_example'>into</span>  high gear  .</p>"
f:Cardinal_numbers,This is the primary frame evoked by the cardinal numbers.,"<p class='list-group-item'>Dr. Malik has confined  almost  a  <span id='phrase_example'>score</span>   of such unfortunates in his basement , you know.</p><p class='list-group-item'>There were <span id='phrase_example'> thirty </span>  of the little blue creatures  staring up at him.</p><p class='list-group-item'>Stephen has more than  five  <span id='phrase_example'> hundred </span> in his closet!   </p><p class='list-group-item'>There are  just over   six  <span id='phrase_example'>billion</span>  people  in the world today.</p>"
f:Temperature,An <em>Entity</em> has a <em>Temperature</em> characterized by the target.  The <em>Temperature</em> is a value of the temperature <em>Attribute</em>.,"<p class='list-group-item'>The pan  is already  too  <span id='phrase_example'>hot</span>  to touch .</p><p class='list-group-item'> The walk-in  was <span id='phrase_example'>freezing</span>, but it was better than hanging out in the kitchen.</p><p class='list-group-item'></p><p class='list-group-item'>Open a window; I'm too <span id='phrase_example'>hot</span>. is not in frame but rather in Subjective_temperature.</p>"
f:Ambient_temperature,"The <em>Temperature</em> in a certain environment, determined by <em>Time</em> and <em>Place</em>, is specified.",<p class='list-group-item'>It's  too  <span id='phrase_example'>hot</span>  to do anything   today .</p><p class='list-group-item'> Nome  is  pretty  <span id='phrase_example'>cold</span>  this time of  year </p><p class='list-group-item'> Last Tuesday  was a  real  <span id='phrase_example'>scorcher</span>.</p><p class='list-group-item'> Tomorrow  is gonna be  <span id='phrase_example'>chilly</span>.</p>
f:Clarity_of_resolution,The <em>Outcome</em> of a contest is described in terms of the <em>Margin</em> between what would be required for victory and the actual <em>Outcome</em>.,"<p class='list-group-item'>The Basque nationalists won a <span id='phrase_example'>narrow</span>  victory  in the regional elections on Sunday.</p><p class='list-group-item'>It was a major victory for workers, and a <span id='phrase_example'>decisive</span>  defeat  for the Tory.</p>"
f:Clemency,An <em>Executive authority</em> exercises their power to reduce or remove negative consequences for someone who has been labeled an <em>Offender</em> who participated in an <em>Crime</em>.,"<p class='list-group-item'>to committing  was granted <span id='phrase_example'>clemency</span>  on December 20, 2002 ,  by Governor Rick Perry .</p><p class='list-group-item'>A Fort Worth man convicted  of a robbery his brother later confessed</p><p class='list-group-item'>to committing  was granted <span id='phrase_example'>clemency</span> on December 20, 2002, by Governor Rick Perry.</p><p class='list-group-item'>Engel represented Robert Bacon,  the first man   Easley  gave <span id='phrase_example'>clemency</span>  in 2001 .    </p><p class='list-group-item'>Ohioans will receive a blow-by-blow account of arguments before the Ohio Parole Board on whether  Cincinnatian John Byrd Jr.  should be executed or granted <span id='phrase_example'>clemency</span>  for a 1983 murder .</p>"
f:Increment,A member or members of a <em>Class</em> have just been  mentioned or are present in the discourse setting and now a different instance  (or group of instances) of the same class is referred to.,<p class='list-group-item'>My husband left me for <span id='phrase_example'>another</span>  woman  -- and now wants to get back together again!</p><p class='list-group-item'>My husband left me for  <span id='phrase_example'>another</span>   woman  -- and now wants to get back together again!</p>
f:Used_up,"Through use, a <em>Resource</em> is diminished in quality or quantity (up to complete attrition) such that it becomes less capable of sustaining future use.",<p class='list-group-item'>My entire life savings  is <span id='phrase_example'>depleted</span>  due to university and medical bills .</p><p class='list-group-item'> All significant oil and gas reserves  are <span id='phrase_example'>exhausted</span> or have dwindled to an uneconomical level except for those of the Middle East.</p><p class='list-group-item'>Use shampoo and conditioner every day until  the shampoo and conditioner  are  completely  <span id='phrase_example'>used up</span>.</p>
f:Historic_event,"In the course of history, an <em>Event</em> or <em>Entity</em> is taken to have importance or significance.","<p class='list-group-item'>Throughout the campaign  activists  have <span id='phrase_example'>made</span>  financial  <span id='phrase_example'>history</span>  as one by one major corporations have yielded to protester power </p><p class='list-group-item'> The conference  was <span id='phrase_example'>historic</span>  for Atlanta's growth as a city .</p><p class='list-group-item'>Many of the <span id='phrase_example'>historic</span>  sites  offer additional outdoor recreation activities.</p><p class='list-group-item'>The James River is arguably the most <span id='phrase_example'>historic</span>  river  in the country and one of the most important rivers in the Southeast.</p><p class='list-group-item'>Take in the <span id='phrase_example'> history </span>, the sawdust-covered floors, and the legendary backroom where the ale flowed during Prohibition.</p>"
f:Launch_process,An <em>Agent</em> acts to begin the life of a <em>Process</em>.,"<p class='list-group-item'>After discovering her knack for organization ,  she decided to try to   <span id='phrase_example'>launch</span>  a career in human resources .</p><p class='list-group-item'> The City of Bratislava  has <span id='phrase_example'>launched</span>  a pilot project of providing internet access in the city centre .</p>"
f:Emotions_by_stimulus,"An <em>Experiencer</em>, <em>Expressor</em>, <em>Event</em>, or <em>State</em> has an emotion as brought on by an <em>Stimulus</em> or <em>Topic</em>.",<p class='list-group-item'>The <span id='phrase_example'>joyful</span>  reunion  took place on Sunday.</p><p class='list-group-item'>The Polish-born Pope was driven past <span id='phrase_example'>jubilant</span>  crowds .</p><p class='list-group-item'> I  am <span id='phrase_example'>glad</span>  about the sheep  .</p>
f:Mental_stimulus_exp_focus,An <em>Experiencer</em> has an emotion as caused by a <em>Stimulus</em> or concerning a <em>Topic</em>.,<p class='list-group-item'>I fall asleep hours later to the sound of their <span id='phrase_example'>engrossed</span>  murmuring .</p><p class='list-group-item'> Most of these great lords  are  downright  <span id='phrase_example'>infatuated</span>  with Italy .</p>
f:Mental_stimulus_stimulus_focus,A <em>Stimulus</em> serves to bring about an emotion of mental stimulation in an <em>Experiencer</em>.,<p class='list-group-item'>You will not easily find a  more  <span id='phrase_example'>absorbing</span>  box-set of piano discs .</p><p class='list-group-item'> New classes of free radical  are  particularly  <span id='phrase_example'>interesting</span>  to chemists .</p>
f:Custom,A <em>Behavior</em> is classified as entrenched for a <em>Protagonist</em> or a <em>Society</em>. The <em>Behavior</em> may be associated with a particular <em>Domain</em> of experience and described with a <em>Descriptor</em>. This indicates that the <em>Behavior</em> is commonly performed by the <em>Protagonist</em> or members of the <em>Society</em>.,"<p class='list-group-item'>It is an  old    Jewish  <span id='phrase_example'>custom</span>. </p><p class='list-group-item'>He was unaware of the  Japanese  <span id='phrase_example'>custom</span>  of waiting until the giver had departed . </p><p class='list-group-item'> The  ancient  <span id='phrase_example'>tradition</span>  of swan-upping  has been taking place on the river Thames.</p><p class='list-group-item'>Smithers thought that  hunting lions  was just another  native  <span id='phrase_example'>custom</span> </p><p class='list-group-item'>Marko showed great respect for the  social  <span id='phrase_example'>customs</span>  of his people .</p><p class='list-group-item'> When I reply to debates , it is  my  <span id='phrase_example'>custom</span>  to have heard all the speeches that have been made .</p>"
f:Stage_of_progress,An <em>Entity</em> is at a particular stage of its development.,"<p class='list-group-item'>The <span id='phrase_example'>Next Generation</span>  Internet  (NGI) Program has been successfully completed.</p><p class='list-group-item'>Osama bin Laden, prime suspect in the US terror attacks, is outfoxing intelligence agencies with his <span id='phrase_example'>low-tech</span>  communication methods .</p><p class='list-group-item'> Kids  are  much more  <span id='phrase_example'>advanced</span>  today   than they were in our era  that is for sure.</p>"
f:First_experience,An implicit experiencer has an <em>Experience</em> for the first time. Some LU's may specifically imply an agentive activity.,"<p class='list-group-item'>In Italy   the term was  <span id='phrase_example'>first</span>  used by the Venetians in 1546 </p><p class='list-group-item'> This time ,  the comet was  <span id='phrase_example'>first</span>  seen on the night of 19th October, 1805 by European observers Jean Louis Pons, Johann Sigismund Huth, and Alexis Bouvard</p>"
f:Continued_state_of_affairs,A <em>State of affairs</em> has held and continues to hold up to the <em>Reference occasion</em>.,"<p class='list-group-item'><span id='phrase_example'>To date</span> ,  the Department already has numerous requests for new systems to be developed .</p><p class='list-group-item'> SAGE has no activities planned   <span id='phrase_example'>as of yet</span> .</p><p class='list-group-item'>PBGC guarantees the benefit  that you had earned  <span id='phrase_example'>up to</span>  the date of plan termination </p><p class='list-group-item'>I think that  she 's  <span id='phrase_example'> still </span>  in her office  .</p>"
f:Intoxication,This frame concerns people being in an altered mental state that is induced by an <em>Intoxicant</em>.,<p class='list-group-item'>Cory  was <span id='phrase_example'>drunk</span>.</p><p class='list-group-item'> Nutty  stormed in <span id='phrase_example'>drunk</span>  as a fiddler .</p>
f:People_by_religion,"This frame contains words for individuals, i.e. humans, with respect to their <em>Religion</em>. The <em>Religion</em> is generally incorporated, but with some lexical units it is specified separately.",<p class='list-group-item'>The bells call the <span id='phrase_example'> faithful </span> to evensong   </p><p class='list-group-item'>A  90-year-old  <span id='phrase_example'> Baptist </span> claims to have seen God personally in his backyard.</p>
f:Presence,"An <em>Entity</em> exists at a particular <em>Location</em>, at a particular <em>Time</em>, as observed by an implicit observer. A <em>Depictive</em> and/or <em>Duration</em> phrase is often found. This frame differs from Existence in that the <em>Location</em> is profiled as a ground where an observer is conceived of as confirming the <em>Entity</em>'s existence.","<p class='list-group-item'>Liquid water  was <span id='phrase_example'>present</span>  on the surface of Mars   billions of years ago .</p><p class='list-group-item'> Urate  was <span id='phrase_example'>present</span>  in varying concentrations   in the bathing solution only .</p><p class='list-group-item'> No one  was <span id='phrase_example'>present</span>.   </p><p class='list-group-item'> Your  <span id='phrase_example'>presence</span> is appreciated.   </p><p class='list-group-item'>In some cases, the <fen>Location</fen> may be recoverable from phrases that primarily express peripheral information:</p><p class='list-group-item'>Was  the senator  <span id='phrase_example'>present</span>  for the committee vote ?</p><p class='list-group-item'>Was the senator <span id='phrase_example'>present</span>  for the committee vote ?</p>"
f:Guest_and_host,"Two individuals, the <em>Guest</em> and the <em>Host</em> are in a temporary social relationship within which the <em>Host</em> provides use of a location or resources for the <em>Guest</em> at a location highly associated with the <em>Host</em> (in many cases, where the <em>Host</em> lives or works). The <em>Guest</em> is not expected to reciprocate the hospitality of the <em>Host</em> while the relationship holds, though may be expected to act as <em>Host</em> at a later time.",<p class='list-group-item'>Commander Silvers  was  the President's  <span id='phrase_example'>guest</span>  last week   at the White House .</p><p class='list-group-item'> Steve Stephens  will be  your  <span id='phrase_example'>host</span>  for the weekend .</p>
f:Social_interaction_evaluation,In this frame an <em>Evaluee</em> is judged by a (usually implicit) <em>Judge</em> to be of a certain character based on her or his <em>Behavior</em> towards other human beings; a specific <em>Affected party</em> may be overtly mentioned along with the <em>Degree</em> to which the <em>Evaluee</em> behaves appropriately towards others. The<em>Behavior</em> alone may be mentioned with the understanding that these behaviors characterize a property of the unmentioned <em>Evaluee</em>. The <em>Evaluee</em>'s <em>Behavior</em> may be in the context of a <em>Topic</em>.,<p class='list-group-item'>It was <span id='phrase_example'>nice</span>  of you   to send a card .  </p><p class='list-group-item'>  Jim  was <span id='phrase_example'>thoughtful</span>  to email the directions . </p><p class='list-group-item'>  For Martha to smoke in the car  was  extremely  <span id='phrase_example'>inconsiderate</span>. </p><p class='list-group-item'> It was <span id='phrase_example'>cruel</span>  that he continued to call her . </p><p class='list-group-item'>  Mary  was <span id='phrase_example'>cruel</span>  to her friends . </p><p class='list-group-item'> Samson was a <span id='phrase_example'>thoughtless</span>  person . </p><p class='list-group-item'> Mrs. Robinson  was always <span id='phrase_example'>considerate</span>  of her students . </p><p class='list-group-item'>  The press  was always <span id='phrase_example'>kind</span>  about Madonna . </p><p class='list-group-item'>  Lee  was <span id='phrase_example'>nice</span>  about my car accident . </p><p class='list-group-item'> I appreciated his <span id='phrase_example'>kind</span>  offer of the car .</p>
f:Age,"An <em>Entity</em> has existed for a length of time, the <em>Age</em>. The <em>Age</em> can be characterized as a value of the age <em>Attribute</em>, or a <em>Degree</em> modifier may express the deviation of the <em>Age</em> from the norm. The <em>Expressor</em> exhibits qualities of the age of the <em>Entity</em>.","<p class='list-group-item'>This building  is  twenty thousand years  <span id='phrase_example'>old</span>.</p><p class='list-group-item'> My grandpa  is  really  <span id='phrase_example'>old</span></p><p class='list-group-item'> Junior  is  only five weeks  <span id='phrase_example'>old</span>.</p><p class='list-group-item'>A cunning <span id='phrase_example'>oldish</span>  voice  called out from the crowd.</p><p class='list-group-item'> His   <span id='phrase_example'>age</span>  was  23   at the time .</p><p class='list-group-item'>  People  of   <span id='phrase_example'>age</span>   55  or older should consult their physician. </p><p class='list-group-item'>I have a  13-year -<span id='phrase_example'>old</span>  cousin </p><p class='list-group-item'> My grandma  is <span id='phrase_example'>old</span></p><p class='list-group-item'>There are additional patterns that the LUs in this frame occur in which are not licensed by a particular lexical head but by a construction.  Additionally, there are patterns that evoke this frame without any overt lexical head that are part of this frame.</p><p class='list-group-item'>She is 45 years of <span id='phrase_example'>age</span>.</p>"
